Fri May 1 11:35:40 2020 -0700,Finish up creating your own components docs
Fri May 1 11:35:40 2020 -0700,Update function names in migration clarify tints and shades are Sass variables
Fri May 1 11:35:40 2020 -0700,Remove mentions of Bootstrap 4 in a few places replacing with updated guidance where appropriate
Thu Apr 30 15:17:08 2020 +0200,v5 Unify spacing across components 30564
Sun Apr 26 17:26:04 2020 -0700,Fill in some unusedcss section links
Sun Apr 26 17:26:04 2020 -0700,Update CSS variables docs
Sun Apr 26 17:26:04 2020 -0700,Include code snippet for lean JS section
Sun Apr 26 17:26:04 2020 -0700,Add example of a custom component using docs callouts
Sun Apr 26 17:26:04 2020 -0700,Update shortcode usage
Sun Apr 26 17:26:04 2020 -0700,wordsmithing
Sun Apr 26 17:26:04 2020 -0700,pull in latest from old theming page
Sun Apr 26 17:26:04 2020 -0700,Use scss docs for color maps
Sun Apr 26 17:26:04 2020 -0700,Add more context to customizing components
Sun Apr 26 17:26:04 2020 -0700,Add overview intro to the Customize section
Sun Apr 26 17:26:04 2020 -0700,Rewrite Theming docs as Customize section
Sun Apr 26 17:26:04 2020 -0700,Create a new table shortcode so we can easily add Bootstrap table classes to Markdown tables
Sun Apr 26 17:26:04 2020 -0700,Rename variables for brevity
Sun Apr 26 17:26:04 2020 -0700,Remove existing Theming page as we build out a new Customize section
Wed Apr 15 16:51:30 2020 -0700,Create config yml
Wed Apr 15 07:22:55 2020 +0300,v5 Improve the responsiveness of our Dashboard example 30573
Tue Apr 14 21:03:56 2020 -0700,Slight adjustment to the h3 heading spacing in docs
Tue Apr 14 23:15:50 2020 +0200,v5 Update system font stack 30561
Tue Apr 14 12:30:49 2020 -0700,Update release drafter yml
Tue Apr 14 12:15:46 2020 -0700,Update release drafter yml
Tue Apr 14 11:12:46 2020 -0700,Merge pull request 30460 from twbs release drafter
Tue Apr 14 13:57:11 2020 +0200,Redo display headings 30568
Mon Apr 13 18:23:56 2020 -0700,Merge pull request 30354 from twbs grid xxl and sidebar toc
Mon Apr 13 15:34:08 2020 -0700,Merge branch master into release drafter
Mon Apr 13 14:40:47 2020 -0700,Update docs for new XXL grid tier
Mon Apr 13 13:55:34 2020 -0700,Clarify media query using 02px and bump from callout to warning
Mon Apr 13 13:55:34 2020 -0700,Update file size for the grid build
Mon Apr 13 13:55:34 2020 -0700,Rewrite grid docs to account for new grid tier
Mon Apr 13 13:55:34 2020 -0700,Move table of contents to new sidebar restyle it to be simpler
Mon Apr 13 13:55:34 2020 -0700,Add an xxl grid tier
Wed Apr 8 20:58:23 2020 +0300,Fix spinner grow animation 30504
Mon Mar 30 11:55:44 2020 -0700,Update release notes yml
Mon Mar 30 11:51:45 2020 -0700,Update release notes yml
Mon Mar 30 11:48:28 2020 -0700,Update release notes yml
Mon Mar 30 11:33:34 2020 -0700,Update release notes yml
Mon Mar 30 11:33:21 2020 -0700,Update release drafter yml
Mon Mar 30 10:58:00 2020 -0700,Update release drafter yml
Mon Mar 30 10:46:16 2020 -0700,Testing
Wed Mar 25 16:05:48 2020 -0700,Create release drafter yml
Wed Mar 25 16:04:37 2020 -0700,Create release notes yml
Tue Mar 24 10:00:45 2020 +0100,Add caption top for tables 30435
Fri Mar 20 08:58:54 2020 -0700,Merge pull request 30389 from twbs underline links
Tue Mar 17 12:26:35 2020 -0700,remove dupe text decoration
Tue Mar 17 12:26:35 2020 -0700,supress underline on toc
Tue Mar 17 12:26:35 2020 -0700,Remove links from docs sidebar
Tue Mar 17 12:26:35 2020 -0700,Enable underlines for links
Wed Mar 4 21:32:45 2020 +0900,Embedded examples cleanup 30330
Sat Feb 15 09:40:27 2020 +0200,Docs table of contents list style fix 30176
Tue Feb 4 11:14:55 2020 +0200,Update migration guide for removal of form text 30134
Mon Nov 25 13:05:57 2019 +0200,Some minor text tweaks
Mon Nov 25 13:05:57 2019 +0200,Copywriting edits
Thu Oct 31 08:30:53 2019 +0200,Doc tweaks
Mon Oct 28 08:12:07 2019 +0100,Update form check to properly support gradients when enabled 29338
Sun Oct 27 20:26:52 2019 -0700,v5 Simplify navbars by requiring containers 29339
Fri Oct 18 11:06:12 2019 -0700,v5 Icons docs cleanup 29450
Fri Oct 18 11:04:27 2019 -0700,v5 Update colors to add shades and tints 29348
Fri Oct 18 10:28:16 2019 +0300,Add link to Icons site in our docs 29544
Thu Oct 17 09:46:34 2019 +0300,Add make col auto mixin 29367
Thu Oct 10 21:18:19 2019 +0300,Add new bg body utility class 29511
Wed Oct 2 22:19:45 2019 +0300,v5 form check layout changes 29322
Thu Sep 5 21:43:31 2019 +0300,Update subnav to remove breadcrumb and just keep versions and search 29368
Fri Aug 30 13:07:27 2019 -0700,Cleanup
Fri Aug 30 13:07:27 2019 -0700,Move margins and equal height via utility example
Fri Aug 30 13:07:27 2019 -0700,First pass at row cols classes
Thu Aug 29 14:07:55 2019 -0600,Clean up instances of old form group 29321
Tue Aug 27 11:10:56 2019 +0300,mention new variable in our docs
Sat Aug 24 02:59:57 2019 +0300,Document example of datalists with form controls 29058
Sat Aug 24 02:26:28 2019 +0300,Add support and docs for color input
Thu Aug 8 11:53:30 2019 -0700,Prep for migration to GitHub Actions CI CD
Mon Aug 5 12:12:16 2019 -0700,Responsive containers follow up to 29095 29118
Sat Aug 3 17:27:33 2019 +0300,Mention pagination margin change in migration docs 29196
Sun Jul 28 15:01:15 2019 -0700,Remove Slack badge link for now
Thu Jul 25 10:25:39 2019 +0300,Fix busted hover focus on sidebar
Thu Jul 25 10:25:39 2019 +0300,Restore 7rem so that the sidebar is balanced on top and bottom
Thu Jul 25 10:25:39 2019 +0300,Increase navbar link brightness for slightly better color contrast
Thu Jul 25 10:25:39 2019 +0300,Split up docs _nav scss
Thu Jul 25 10:25:39 2019 +0300,Restore height and overflow on docs sidebar
Wed Jul 24 09:13:50 2019 +0300,Rebuild the dist to pickup new utilities file 29105
Mon Jul 22 10:38:28 2019 -0700,fix broken classes
Mon Jul 22 16:08:58 2019 +0300,Use html like every other example change the layout simplify some things for now
Sun Jul 21 21:44:32 2019 -0700,Move search styles prep for responsive containers in docs
Sun Jul 21 21:44:32 2019 -0700,no need for checks or conditions
Sun Jul 21 21:44:32 2019 -0700,remove subnav from home and examples
Sun Jul 21 21:44:32 2019 -0700,Make subnav and sidebar work on mobile too
Sun Jul 21 21:44:32 2019 -0700,make docs navbar more usable on mobile
Sun Jul 21 21:44:32 2019 -0700,Move subnav to partial take first pass at conditionalizing breadcrumb links
Sun Jul 21 21:44:32 2019 -0700,Add focus to all new hover selectors
Sun Jul 21 21:44:32 2019 -0700,Update remaining tables to Bootstrap tables in docs by adding table class
Sun Jul 21 21:44:32 2019 -0700,Document changes to tables
Sun Jul 21 21:44:32 2019 -0700,Clarify form control visual updates in migration guide
Sun Jul 21 21:44:32 2019 -0700,Update Migration docs to mention new icons
Sun Jul 21 21:44:32 2019 -0700,Revert padding right on ol and ul in Reboot update migration doc
Sun Jul 21 17:38:36 2019 -0700,v4 v5 Add responsive containers 29095
Wed Jul 17 16:56:54 2019 +0300,Use focus within for form file focus state 29036
Wed Jul 17 16:21:47 2019 +0300,Move sidebar icon to CSS
Mon Jul 15 10:29:13 2019 +0300,v5 Reuse box shadow variables 29023
Sun Jul 14 12:00:57 2019 +0300,v5 Fix disabled styling on form file 29022
Sun Jul 14 11:44:49 2019 +0300,Drop breakpoint CSS custom properties 29020
Fri Jul 12 16:56:26 2019 -0500,dist v5
Fri Jul 12 16:52:33 2019 -0500,v5 Forms update 28450
Tue Jul 9 14:30:07 2019 -0500,Fixes 28994
Thu May 9 07:57:58 2019 +0200,v5 Drop all print styles and classes 28339
Wed May 8 21:45:24 2019 +0300,v5 Drop media 28265
Wed May 8 20:58:07 2019 +0300,Drop all hover mixins
Fri May 3 10:54:29 2019 -0700,WIP Bump supported browsers for v5 28317
Fri May 3 10:52:58 2019 -0700,WIP v5 Prep migration docs page 28472
Thu Apr 25 17:01:50 2019 +0300,Prevent form validation mixin from generating invalid CSS 28447
Mon Mar 18 12:26:50 2019 +0200,Update GA to latest script anonymize IPs
Thu Mar 14 19:23:54 2019 +0200,v5 Drop remaining deprecated mixins 28461
Thu Mar 14 19:15:26 2019 +0200,v5 Update badges 28458
Wed Mar 13 19:07:54 2019 -0700,Revert Don t run Google Analytics locally 28384 28489
Tue Mar 12 15:04:08 2019 +0200,v5 Don t automatically adjust all hr elements in alert variants 28462
Tue Mar 12 10:02:17 2019 +0200,v5 Drop deprecated size mixin 28460
Tue Mar 12 09:47:36 2019 +0200,Drop deprecated img retina mixin 28459
Wed Feb 20 22:05:45 2019 +0200,Remove IE specific breadcrumb CSS hack
Mon Feb 11 11:15:34 2019 -0800,Release v4 3 0 28228
Fri Jan 11 21:16:50 2019 +0200,Add form validation states Sass map 27999
Tue Jan 8 21:23:50 2019 +0200,npm run test to build dist files
Mon Jan 7 03:01:36 2019 +0200,Add horizontal list group modifier 27970
Fri Jan 4 08:29:45 2019 -0800,latest changes
Fri Jan 4 11:53:32 2019 +0200,Add note to the summary of important changes
Sun Dec 23 15:00:51 2018 +0200,Add horizontal card example 27906
Sat Dec 22 22:20:26 2018 -0800,move to 4 2
Fri Dec 21 21:10:40 2018 -0800,Add a notes about multiple links targets remove multiple link example
Fri Dec 21 20:59:40 2018 -0800,Add variable for dropdown divider margin y 27857
Fri Dec 21 15:36:09 2018 -0800,Merge branch table dark colors into v4 dev
Fri Dec 21 15:35:55 2018 -0800,Merge branch text break util into v4 dev
Fri Dec 21 15:35:15 2018 -0800,dist
Fri Dec 21 14:49:11 2018 -0800,Merge branch table dark colors into v4 dev
Fri Dec 21 14:47:52 2018 -0800,Merge branch text break util into v4 dev
Fri Dec 21 13:52:02 2018 -0800,Prevent checks from shrinking in inline forms 27870
Fri Dec 21 13:51:38 2018 -0800,Add table hover color variables 27850
Fri Dec 21 13:48:53 2018 -0800,Merge branch validation support list into v4 dev
Fri Dec 21 13:48:44 2018 -0800,Merge branch table hover colors into v4 dev
Fri Dec 21 13:48:19 2018 -0800,Merge branch grid vertical alignment ie warning into v4 dev
Fri Dec 21 10:55:28 2018 -0800,Bump to v4 2 1 27892
Fri Dec 21 09:03:29 2018 -0800,Prep for v4 2 0 release
Mon Dec 17 09:58:18 2018 -0800,Add docs for text break
Sun Dec 16 13:23:33 2018 -0800,Add new text break utility for applying word break break word
Sun Dec 16 01:33:05 2018 +0200,dist
Sat Dec 15 14:25:40 2018 -0800,List out what s supported in validation styles Fixes 27169
Sat Dec 15 14:01:09 2018 -0800,Add table hover color variables Fixes 26465
Sat Dec 15 13:51:20 2018 -0800,Fixes 26468 Mention min height issue in IE10 11 for flexbox vertical alignment
Sat Dec 15 20:18:55 2018 +0100,Update site docs 4 1 utilities stretched link md
Sat Dec 15 20:17:45 2018 +0100,Update site docs 4 1 utilities stretched link md
Sat Dec 15 20:15:03 2018 +0100,Update site docs 4 1 utilities stretched link md
Sat Dec 15 20:14:42 2018 +0100,Copy change
Sat Dec 15 20:14:05 2018 +0100,Copy change
Sat Dec 15 10:15:52 2018 -0800,Match table dark background color to the dark variable
Tue Nov 13 08:47:32 2018 +0200,Clean up some docs for toasts
Tue Nov 13 08:47:32 2018 +0200,Nest the toast show and use display block as inherit causes broken styles
Tue Nov 13 08:47:32 2018 +0200,Add new toasts component
Tue Nov 13 08:21:57 2018 +0200,Add Bootstrap s very first spinners omfg it s actually happening
Sat Oct 20 16:00:28 2018 +0300,Remove service worker
Mon Oct 15 16:17:42 2018 +0300,Add a CODEOWNERS file 27271
Sat Oct 6 17:55:55 2018 -0700,Add overflow auto and overflow hidden utilities
Tue Sep 18 22:14:45 2018 -0700,Remove flex utilities from list group item s as they re display block meaning the utilities have no affect Closes 27162
Tue Sep 18 21:42:38 2018 -0700,dist
Tue Sep 18 21:35:56 2018 -0700,Merge branch v4 dev of https github com twbs bootstrap into v4 dev
Tue Sep 18 21:35:40 2018 -0700,dist
Tue Sep 18 21:27:02 2018 -0700,Add new variables for form feedback tooltips 26959
Tue Sep 18 16:29:46 2018 +0300,Consistently re use input variables
Tue Sep 18 14:51:34 2018 +0300,Document input group wrapping behavior and override via utility class Fixes 25409
Tue Sep 18 13:03:44 2018 +0300,Clarify docs for custom form structure Fixes 25440
Mon Sep 17 12:36:49 2018 -0700,dist
Mon Sep 17 12:34:41 2018 -0700,Merge branch v4 dev of https github com twbs bootstrap into v4 dev
Mon Sep 17 12:34:34 2018 -0700,dist
Mon Sep 17 09:06:12 2018 +0300,Update copy
Sun Sep 16 02:04:32 2018 +0300,Simplify HTML and CSS
Sun Sep 2 13:57:25 2018 -0700,Add new docs Versions page
Sat Aug 25 19:02:15 2018 +0300,Specify new height for inputs in floating label example after v4 1 3 s addition of a fixed height property on form control
Sat Aug 25 18:49:09 2018 +0300,Round corners on modal footer
Sat Aug 18 20:22:08 2018 -0700,dist
Sun Jul 29 14:18:09 2018 -0700,Merge branch form validation icons into v4 dev
Sun Jul 29 13:02:42 2018 -0700,dist
Sat Jul 28 21:34:27 2018 -0700,Add margin utils to the grid for fully functional grid control 26957
Tue Jul 24 17:26:29 2018 -0700,Merge branch garhbod patch 1 into v4 dev
Tue Jul 24 17:25:12 2018 -0700,Merge branch v4 dev into malkomich v4 dev
Tue Jul 24 08:54:34 2018 -0700,Ship v4 1 3
Mon Jul 23 17:51:14 2018 -0700,dist
Fri Jul 20 19:11:23 2018 -0500,Clarify to close 26329
Fri Jul 20 18:34:57 2018 -0500,Merge branch document tooltip flickering of https github com simPod bootstrap into simPod document tooltip flickering
Fri Jul 20 18:24:14 2018 -0500,Add Noto Color Emoji to font stack
Fri Jul 20 18:23:42 2018 -0500,Clarify custom select styles
Fri Jul 20 18:21:40 2018 -0500,Update validation tooltips to use tooltip vars 26887
Fri Jul 20 18:18:48 2018 -0500,Improve responsive table docs
Sun Jul 15 22:46:37 2018 -0700,Merge branch v4 dev of https github com Varunram bootstrap into Varunram v4 dev
Sun Jul 15 22:27:36 2018 -0700,More wordsmithing
Sun Jul 15 14:16:35 2018 -0700,dist
Sun Jul 15 14:00:23 2018 -0700,Form control heights 26820
Sat Jul 14 21:10:45 2018 -0700,fixes 26579
Sat Jul 14 15:14:29 2018 -0700,Update cursor on floating labels example 26826
Sat Jul 14 14:07:14 2018 -0700,Merge branch examples cleanup of https github com MartijnCuppens bootstrap into MartijnCuppens examples cleanup
Sat Jul 14 14:04:39 2018 -0700,Merge branch box shadow_issue_26377 of https github com parammittal16 bootstrap into parammittal16 box shadow_issue_26377
Fri Jul 13 09:31:55 2018 -0700,Update issue templates
Fri Jul 13 09:30:58 2018 -0700,Update issue template
Thu Jul 12 09:27:14 2018 -0700,Update README md
Thu Jul 12 09:27:14 2018 -0700,Ship v4 1 2
Wed Jul 11 23:30:46 2018 -0700,update card columns docs to make copy more accurate
Wed Jul 11 23:30:46 2018 -0700,clarify docs dev and add 4 0 link
Wed Jul 11 23:30:46 2018 -0700,change dist to only affect main since docs css isn t distributed
Wed Jul 11 23:30:46 2018 -0700,Move copy tasks back to css main and js compile so docs github task runs properly
Wed Jul 11 23:30:46 2018 -0700,Update watch scripts to properly copy JS files Updates nodemon scripts to watch specific directories instead of ignoring several Split watch tasks for CSS and JS into main and docs Add docs watch script to serve the docs instead of just build Add new start script so that instead of two tabs one for docs watch and one for watch we just run npm start
Wed Jul 11 23:30:46 2018 -0700,fixes 26637
Wed Jul 11 23:30:46 2018 -0700,new url
Wed Jul 11 23:30:46 2018 -0700,remove jobs link
Wed Jul 11 23:30:46 2018 -0700,Reorganize docs for easier deploys
Wed Jul 11 21:42:55 2018 -0700,dist
Sun Jul 8 18:43:40 2018 -0700,disable to fix ci
Sun Jul 8 18:18:13 2018 -0700,add grid docs mention
Sun Jul 8 17:29:01 2018 -0700,fix comment placement remove unecessary prop wrapper
Sun Jul 8 17:28:37 2018 -0700,add docs
Sun Jul 8 16:46:44 2018 -0700,Merge branch patch 1 of https github com garhbod bootstrap into garhbod patch 1
Sun Jul 8 15:31:18 2018 -0700,Restore feedback icons on validated form fields
Sat Jul 7 20:21:01 2018 -0700,class
Sat Jul 7 20:15:48 2018 -0700,add table of classes
Sat Jul 7 19:47:21 2018 -0700,fix docs heading
Sat Jul 7 16:16:43 2018 -0700,Merge branch v4 dev of https github com malkomich bootstrap into malkomich v4 dev
Sun Jun 24 13:13:42 2018 -0700,dist
Sun Jun 24 13:07:49 2018 -0700,Update box shadows on custom select 26754
Thu Jun 21 22:55:23 2018 -0700,dist
Sun May 20 15:10:31 2018 -0700,closes 26543 fixes 26542
Mon Apr 30 09:04:33 2018 -0700,Bump version to v4 1 1
Sun Apr 29 22:22:04 2018 -0700,dist
Sun Apr 29 17:02:38 2018 -0700,Simplify custom file inner height for generated browse button
Mon Apr 23 21:54:40 2018 -0700,add validation styles for form control file 26181
Tue Apr 17 10:30:16 2018 -0700,typo
Tue Apr 17 08:33:44 2018 -0700,Be explicit in the docs for deprecating text hide
Mon Apr 9 09:00:23 2018 -0700,Ship v4 1 0 26218
Sat Apr 7 11:59:46 2018 -0700,closes 26213
Thu Apr 5 14:08:18 2018 -0700,Merge branch v4 dev of https github com twbs bootstrap into v4 dev
Thu Apr 5 14:08:13 2018 -0700,add examples to theming docs section on css vars in media queries closes 26205
Sun Apr 1 18:21:41 2018 -0700,dist
Sun Apr 1 18:15:06 2018 -0700,Update offcanvas example for IE support
Sun Apr 1 18:14:07 2018 -0700,Dashboard updates 26179
Sun Apr 1 12:58:03 2018 -0700,docs edit suggestion
Sat Mar 31 22:15:15 2018 -0700,dist
Sat Mar 31 22:10:32 2018 -0700,Deprecate text hide 26173
Sat Mar 31 22:07:48 2018 -0700,Add box shadow utilities 25758
Sat Mar 31 22:06:41 2018 -0700,Mention browserslist config in our docs to close 25429
Sat Mar 31 22:05:09 2018 -0700,Add new flex grow and flex shrink utils
Sat Mar 31 22:04:14 2018 -0700,Fix Chrome s rendering of card columns
Sat Mar 31 22:02:47 2018 -0700,document new text color utils
Sat Mar 31 22:02:47 2018 -0700,add 50 translucent black and white text
Sat Mar 31 22:02:47 2018 -0700,add text body fixes 25412
Sat Mar 31 22:02:02 2018 -0700,Close 25697
Sat Mar 31 21:58:57 2018 -0700,Add text monospace util
Sat Mar 31 18:36:10 2018 -0700,fixes 25343 by mentioning how collapse animates in docs
Sat Mar 31 15:07:26 2018 -0700,Add small not to float docs about mixing with flex items
Sat Mar 31 13:59:37 2018 -0700,dist
Sat Mar 31 13:55:40 2018 -0700,fixes 25918
Sat Mar 17 16:44:58 2018 -0700,Separate issue templates add support doc 25705
Sun Mar 4 11:16:54 2018 -0800,Update blockquote migration docs to reflect 22949
Sun Mar 4 11:07:31 2018 -0800,Fix 25746
Sat Mar 3 14:10:49 2018 -0800,dist
Sat Feb 24 12:46:23 2018 -0800,Fixes 25703
Sat Feb 24 12:44:44 2018 -0800,dist
Sat Feb 24 12:38:51 2018 -0800,Merge branch v4 dev of https github com twbs bootstrap into v4 dev
Mon Feb 19 18:15:44 2018 -0800,make it a var
Mon Feb 19 18:14:50 2018 -0800,Merge branch nav divider mixin of https github com ysds bootstrap into ysds nav divider mixin
Mon Feb 19 15:04:55 2018 -0800,Merge branch accordion borders of https github com andresgalante bootstrap into v4 dev
Mon Feb 19 14:50:56 2018 -0800,dist
Mon Feb 19 14:40:59 2018 -0800,Custom range input 25600
Sun Feb 11 15:09:05 2018 -0800,Fix border radius on Browse button for custom file input inside input groups 25356
Sun Feb 11 15:05:50 2018 -0800,Update sr only mixin and utility 25197
Sun Feb 11 14:53:29 2018 -0800,dist
Sat Feb 3 10:02:14 2018 +0200,Clarify migration docs to remove mention of table responsive being for the parent element vs the table element itself 25539
Fri Feb 2 22:38:01 2018 -0800,close 25534
Fri Feb 2 14:25:47 2018 +0200,Override custom select width in form inline 25414
Sun Jan 21 22:51:08 2018 -0800,Feature Add carousel fade option 22958
Sun Jan 21 22:40:55 2018 -0800,v4 1 Add dropdown item text 22965
Sun Jan 21 12:16:17 2018 -0800,Document flex fill class in flex utils
Sun Jan 21 12:15:12 2018 -0800,Use variables for theme color level function
Sat Jan 20 15:11:19 2018 -0800,tweak html
Sat Jan 20 15:10:19 2018 -0800,rearrange and override extra borders
Sat Jan 20 15:06:02 2018 -0800,Merge branch borderless table of https github com Varunram bootstrap into Varunram borderless table
Sat Jan 20 12:16:37 2018 -0800,dist
Thu Jan 18 10:29:48 2018 -0800,Remove Pre from Nuget install info since we re stable now cc supergibbs
Thu Jan 18 10:24:51 2018 -0800,Bump version to 4 0 0
Wed Jan 17 23:00:27 2018 -0800,Restore sidebar nav link to Approach page
Wed Jan 17 17:37:06 2018 -0800,dist
Wed Jan 17 17:35:48 2018 -0800,Consistently sized 960x600 wide images
Wed Jan 17 17:35:48 2018 -0800,Only 2 col on sm
Wed Jan 17 17:29:28 2018 -0800,Prevent print utils from overriding all other display utils 25269
Thu Jan 18 01:45:25 2018 +0200,Outline button hover color 25339
Tue Jan 16 20:21:13 2018 -0800,dist
Mon Jan 15 21:44:04 2018 -0800,Mention input group text in migration docs 25325
Mon Jan 15 21:42:33 2018 -0800,Adjust language
Mon Jan 15 21:39:27 2018 -0800,Merge branch form check input validation of https github com supergibbs bootstrap into supergibbs form check input validation
Mon Jan 15 19:41:07 2018 -0800,closes 25280
Mon Jan 15 09:19:12 2018 +0200,Add example of a Spanish translation for custom file input 25302
Mon Jan 15 08:57:10 2018 +0200,Add display utilities to bootstrap grid scss 25308
Sun Jan 14 20:08:58 2018 -0800,Update copyright for 2k18 25303
Sun Jan 14 20:07:57 2018 -0800,Theming docs update 25300
Sun Jan 14 16:58:18 2018 -0800,one more img compression
Sun Jan 14 16:06:52 2018 -0800,Examples updates 24898
Sun Jan 14 15:58:16 2018 -0800,dist
Sat Jan 13 19:18:41 2018 -0800,dist
Sat Jan 13 18:58:48 2018 -0800,Merge branch v4 dev of https github com twbs bootstrap into v4 dev
Sun Jan 14 02:34:31 2018 +0200,Add new Approach docs page 25165
Fri Jan 12 17:32:56 2018 -0800,Merge branch custom check disabled of https github com gijsbotje bootstrap into v4 dev
Thu Jan 11 22:42:40 2018 -0800,dist
Thu Jan 11 10:12:15 2018 +0000,Deprecate hover media query shim and mixins 25270
Wed Jan 3 16:03:22 2018 -0800,dist
Wed Jan 3 16:01:03 2018 -0800,Print tweaks 25164
Tue Jan 2 22:58:40 2018 -0800,Add some documentation on using CSS vars 25176
Tue Jan 2 21:57:56 2018 -0800,Validation tooltip example 25143
Tue Jan 2 21:49:01 2018 -0800,Update pagination focus styles
Tue Jan 2 21:19:29 2018 -0800,dist
Tue Jan 2 21:18:14 2018 -0800,add example of textarea to docs
Tue Jan 2 21:14:02 2018 -0800,Merge branch patch 8 of https github com gijsbotje bootstrap into gijsbotje patch 8
Mon Jan 1 20:51:20 2018 -0800,improve additive subtractive border util docs
Mon Jan 1 20:50:59 2018 -0800,Darken border color slightly
Mon Jan 1 20:32:44 2018 -0800,Merge branch docs border utilities of https github com ysds bootstrap into ysds docs border utilities
Mon Jan 1 20:29:19 2018 -0800,dist
Sat Dec 30 21:34:23 2017 -0800,dist
Sat Dec 30 20:55:35 2017 -0800,Outline active focus 25145
Sat Dec 30 19:41:36 2017 -0800,dist
Sun Dec 31 02:38:09 2017 +0200,Mention file text change in Migration docs 25144
Sat Dec 30 18:01:36 2017 +0200,drop simply and tweak a few other bits
Sat Dec 30 17:29:36 2017 +0200,Update Theming docs for removing map items 25108
Fri Dec 29 21:03:35 2017 +0000,Darken gray 600 by 10 for AA contrast 25123
Thu Dec 28 10:47:34 2017 -0800,Remove margin bottom on bd example 25048
Thu Dec 28 10:26:43 2017 -0800,Add examples of disabled tooltip and popover triggers
Thu Dec 28 10:24:08 2017 -0800,Improve lint vars output messaging 25049
Thu Dec 28 10:23:04 2017 -0800,Expand border utilities to include top right bottom left
Thu Dec 28 10:20:34 2017 -0800,linting
Thu Dec 28 10:20:34 2017 -0800,Move alert theme color levels to variables
Thu Dec 28 10:19:27 2017 -0800,add note about single vs group
Thu Dec 28 10:19:27 2017 -0800,Update JS powered buttons docs to include single button example
Thu Dec 28 09:50:04 2017 -0800,Update version to 4 0 0 beta 3
Wed Dec 27 21:08:51 2017 -0800,npm dist
Wed Dec 27 17:56:28 2017 -0800,apply same active focus shadow styling to button variants
Wed Dec 27 17:56:28 2017 -0800,line break
Wed Dec 27 17:56:28 2017 -0800,fix mixin include
Wed Dec 27 17:56:28 2017 -0800,Only apply the active and focus shadow on the focus state for active
Wed Dec 27 16:30:18 2017 -0800,dist
Wed Dec 27 16:20:10 2017 -0800,dist
Wed Dec 27 13:41:15 2017 -0800,extra space
Wed Dec 27 13:41:06 2017 -0800,closes 24929
Wed Dec 27 13:40:51 2017 -0800,improve docs tables
Tue Dec 26 22:30:04 2017 -0800,dist
Tue Dec 26 22:28:14 2017 -0800,Merge branch v4 dev of https github com twbs bootstrap into v4 dev
Tue Dec 26 22:28:04 2017 -0800,dist
Tue Dec 26 22:02:54 2017 -0800,linting
Tue Dec 26 21:58:57 2017 -0800,un nest and un chain popover classes
Tue Dec 26 21:56:48 2017 -0800,consolidate content properties un nest
Tue Dec 26 21:54:47 2017 -0800,smaller popover arrows for more reasonable visuals and more ideal pixel rounding
Tue Dec 26 21:50:23 2017 -0800,remove popover static example
Tue Dec 26 21:45:53 2017 -0800,remove broken static demo
Tue Dec 26 21:36:12 2017 -0800,Merge branch fix arrows of https github com simonihmig bootstrap into simonihmig fix arrows
Tue Dec 26 16:14:08 2017 -0800,Rewrite custom file input
Tue Dec 26 13:50:15 2017 -0800,dist
Tue Dec 26 13:47:48 2017 -0800,Darken table border color
Tue Dec 26 13:33:29 2017 -0800,dist
Tue Dec 26 13:31:53 2017 -0800,Merge branch v4 dev of https github com twbs bootstrap into v4 dev
Tue Dec 26 13:31:42 2017 -0800,dist
Tue Dec 26 13:21:08 2017 -0800,Closes 25039
Tue Dec 26 13:20:12 2017 -0800,Update SCSS import order to have print styles last
Tue Dec 26 13:18:19 2017 -0800,Move from h4s and misc to h5s so headings from example snippets don t show in our table of contents
Sat Dec 23 17:50:52 2017 -0800,remove input group overrides since they re defaults now
Sat Dec 23 17:50:52 2017 -0800,space custom select sizing examples
Sat Dec 23 17:50:52 2017 -0800,Make custom select and file inputs 100 wide
Sat Dec 23 16:47:33 2017 -0800,closes 24973
Sat Dec 23 16:19:49 2017 -0800,prefix those
Sat Dec 23 16:19:33 2017 -0800,change heading
Sat Dec 23 13:17:23 2017 -0800,further clarify z index docs fix 24999
Fri Dec 22 21:02:36 2017 -0800,dist
Fri Dec 22 20:09:58 2017 -0800,Move table responsive to a parent class instead of a modifier
Fri Dec 22 17:15:46 2017 -0800,dist
